day,theme,hook,technical_angle,hashtags
1,AI-assisted approach monitoring for large vessels,Last month in Bilbao I watched a capstan log tell a story the bridge summary missed.,"Sensor fusion on AIS, DGPS, and winch torque for closed-loop berthing advisory signals.",#PortAutomation #Berthing #MarineAI #Prosertek #Safety
2,Real-time fender deflection analytics on the berth face,A fender that looks idle can still be carrying asymmetric energy into the dolphins.,"Strain-gauge layouts, temperature compensation, and alarm rationalization in BAS.",#BerthingSystems #StructuralHealth #Ports #Instrumentation #BAS
3,Berthing energy models vs. measured line tension,The spreadsheet said 'comfortable margins'; the trend line disagreed during a squall.,Comparing mooring line stiffness assumptions with PLC-logged hook loads and dampers.,#Mooring #DigitalTwin #Harbor #PLC #MarineOps
4,Human-in-the-loop vs autonomy in assisted docking,We still design for the operator who has three alarms and one good decision window.,"HMI layering, interlocks, and IEC 62443-style zones for assisted maneuvering systems.",#HumanFactors #Automation #Maritime #CyberSecurity #HMI
5,Video analytics for line-of-sight obstructions at quay,Fog is not a camera fault; it is an operating mode.,Edge inference on GPU-less industrial PCs and conservative fail-safe paths.,#ComputerVision #EdgeAI #PortSafety #IIoT #Spain
6,Digital twin of berth occupancy and crane choreography,"When two cranes share airspace, the twin is less 'nice to have' and more 'risk register'.","Time-series alignment between TOS events, radar tracks, and PLC interlocks.",#DigitalTwin #Cranes #TerminalOps #DataIntegration #Logistics
7,Cyber-physical alarms in vessel–shore coordination,The most dangerous state is 'green light' with stale context.,"Signed telemetry, replay-safe logging, and operator attestations for go/no-go.",#CyberPhysical #AlarmManagement #Ports #IEC62443 #Operations
8,Closing the loop: from pilot feedback to PLC setpoints,A smooth landing is a control problem dressed as a cultural habit.,"PID hygiene, rate limits, and anti-windup on shared hydraulic power units.",#ControlSystems #Hydraulics #PLC #MarineEngineering #Automation
9,Automated quick release hooks and interlocking narratives,"If the hook story and the winch story disagree, the PLC should refuse the fiction.","QRH state machines, pin sensors, and permissive chains mapped to maintenance windows.",#Mooring #QRH #Safety #PLC #Ports
10,Bollard load cells: calibration drift in saline cycles,Salt fog is a slow-motion denial-of-service attack on your reference.,"Six-month calibration policy, temperature compensation, and cross-checks with ship lines.",#Bollards #LoadCells #Calibration #Marine #Reliability
11,Machine vision for bollard fairlead wear classification,We stopped arguing about 'how worn' when the model showed the same groove twice.,"Contrastive training on site photos, uncertainty thresholds, and human review queues.",#MachineVision #InspectionAI #Maintenance #Ports #Quality
12,Mooring line creep detection with distributed sensing,Creep whispers before it shouts.,"Fiber sensing vs. point load cells — cost, fragility, and retrofit constraints.",#StructuralHealth #Mooring #Sensors #RiskManagement #Engineering
13,Hydraulic tensioners: thermal derating in summer berth,Oil viscosity is a silent participant in every mooring plan.,"VFD-assisted pump schedules, cooler health, and PLC alarms tied to oil analytics.",#Hydraulics #VFD #Thermal #PLC #PortOps
14,Worksite rules encoding for autonomous mooring assistants,Automation without jurisdiction is just motion.,"Permissive matrices, maintenance holds, and ATEX zoning overlays in the PLC.",#Safety #ATEX #Automation #Compliance #Ports
15,Fleet learning across mooring events (privacy preserving),"We share patterns, not ship names.",Federated statistics on peak loads and anomaly flags for class discussions.,#FederatedLearning #DataEthics #Maritime #AI #Operations
16,Operator trust curves after a near-miss,Trust is rebuilt in smaller proof steps than the original incident.,"Progressive automation exposure, logging transparency, and drill cadence.",#HumanFactors #SafetyCulture #Training #Ports #Leadership
17,Gangway interlocks that respect human impatience,People will defeat a rude interlock; design for courteous enforcement.,"Dual-channel inputs, debouncing, and explicit override auditing to SCADA.",#Gangway #SafetyPLC #Interlocks #SCADA #Ports
18,Pitch/roll thresholds vs. actual vessel motion spectra,A single threshold is a bet against meteorology.,"PLC filtering of IMU data, gust buffering, and operator-readable margin gauges.",#MotionMonitoring #PLC #IMU #MarineOps #Safety
19,Fail-safe braking and hydraulic lock sequencing,"Stopping is a choreography, not an event.","Valve provenance, accumulator health, and deterministic shutdown paths.",#Hydraulics #FunctionalSafety #PLC #Maintenance #Ports
20,SIL thinking without SIL washing,A SIL sticker never replaced a traceable test record.,"Evidence bundles: FAT scripts, field overrides, and periodic proof tests.",#FunctionalSafety #IEC61508 #Validation #Engineering #Compliance
21,Ethernet/IP to the gangway: segmentation that survives audits,Flat OT networks age poorly in public terminals.,"VLANs, ACLs, and jump-host patterns for Rockwell and Siemens islands.",#OTSecurity #EthernetIP #NetworkSegmentation #Ports #CyberSecurity
22,Remote support access with lawyer-proof session logs,"If you cannot explain the session, you cannot explain the incident.","Break-glass workflows, video attestations, and immutable log shipping.",#RemoteSupport #Compliance #OT #Governance #Ports
23,Testing gangway software after TIA or Studio updates,Compiler upgrades deserve respect.,Regression matrices bridging safety PLC and HMI behavior.,#ChangeManagement #PLC #Validation #TIA #Automation
24,When the gangway becomes a data product,Passenger minutes on the brow are also reliability minutes.,Aggregated availability metrics feeding terminal KPIs without PII leakage.,#IIoT #Analytics #Operations #Privacy #SmartPorts
25,Cryogenic instrumentation: the humility of cold service sensors,"At -160C, 'spec sheet confident' is not the same as 'field calm'.","RTD vs. thermocouple trade-offs, sheath materials, and proof testing cadence.",#LNG #Instrumentation #Cryogenics #Safety #Terminals
26,ESD philosophy: speed vs. operability in jetty manifolds,Fast is not always kind to neighboring processes.,"Cause-and-effect matrices, valve stroke proofs, and staged blowdown narratives.",#ESD #LNG #ProcessSafety #Valves #Engineering
27,Boil-off management and predictive alarms,"Tank breathing is a signal, not noise.",Multivariate limits on pressure/temperature trends with winter/summer baselines.,#LNG #PredictiveMaintenance #AlarmManagement #Analytics #Terminals
28,Flame detection zoning on LNG berths,We map pixels and chemistry to a permit-to-work reality.,"IR/UV sensor fusion, maintenance windows, and nuisance alarm triage.",#FireSafety #LNG #Instrumentation #Ports #Risk
29,Custody transfer metering traceability,"A dispute is won on evidence density, not rhetoric.","Coriolis diagnostics, density corrections, and audit trails into informes workflows.",#CustodyTransfer #Metering #Compliance #LNG #Traceability
30,Loading arm vibration signatures as early warnings,The arm tells you about ship motion coupling before the paperwork does.,"Accelerometer features, PLC edge thresholds, and maintenance tickets.",#ConditionMonitoring #LNG #Mechanical #Ports #IIoT
31,Operator consoles: cognitive load during simultaneous alarms,Alarm floods are a UI failure as much as a process upset.,"Prioritization layers, suppression policies, and training drills.",#HMI #AlarmManagement #HumanFactors #LNG #Operations
32,Integrating SIL and cybersecurity assessments for LNG automation,Two different languages; one physical plant.,"Joint hazard workshops, zones & conduits, and evidence for insurers.",#CyberSecurity #FunctionalSafety #LNG #Risk #Integration
33,TIA Portal library discipline for brownfield ports,Copy-paste is a mortgage on future you.,"Master copies, types, and change propagation across cranes and conveyors.",#TIAPortal #Siemens #PLC #SoftwareEngineering #Automation
34,S7-1500R redundancy: what 'seamless' really means on site,Failover stories are written in milliseconds and verified in maintenance windows.,"Sync links, diagnostic buffers, and ring topology pitfalls.",#S71500 #Redundancy #PLC #Ports #Reliability
35,Structured text vs. ladder for safety interlocks,Choose clarity over cleverness where limbs are in the loop.,"Patterns for interlock testing, forced variables, and documentation hooks.",#StructuredText #PLCProgramming #Safety #TIA #BestPractices
36,OPC-UA from S7 to Azure: certificate hygiene,Your cloud journey starts in the trust store.,"GDS concepts, rotation, and monitoring cert expiry as an operational alarm.",#OPCUA #Azure #IIoT #Security #Siemens
37,Version control for PLC projects: pragmatism without theatre,Git is not magic; discipline is.,"Branching for FAT/SAT, binary merges, and review rituals that teams actually do.",#DevOps #PLC #VersionControl #Engineering #Automation
38,Analog scaling and filtering for noisy deck environments,"A spike is sometimes a welding event, not a process insight.","Moving averages, outlier rejection, and alarm delay policies.",#SignalProcessing #PLC #Instrumentation #Ports #TIA
39,Safety PLC integration with standard controllers,"Two CPUs, one machine — negotiate honestly.","PROFIsafe wiring assumptions, test interfaces, and commissioning stories.",#PROFIsafe #SafetyPLC #Siemens #Integration #Commissioning
40,Commissioning notebooks: from I/O check to digital handover,"If it is not recorded, it did not happen — especially on night shift.","Templates aligned with FAT/SAT, photos, and parameter hashes.",#Commissioning #Quality #Documentation #Ports #Engineering
41,Sysmac Studio: reusable cam profiles for cyclical machinery,Cam tables are contracts between mechanical and software reality.,"Electronic camming, phase offsets, and recovery after emergency stops.",#SysmacStudio #Omron #MotionControl #Automation #Ports
42,NJ/NX cycle time budgeting under fieldbus load,"Determinism is a budget, not a vibe.","Task partitioning, EtherCAT jitter checks, and diagnostic counters.",#EtherCAT #PLC #RealTime #Omron #Engineering
43,Safety I/O on Omron: reset strategies operators understand,Mystery resets erode trust faster than downtime.,"Explicit reset paths, guard door narratives, and teach mode policies.",#SafetyPLC #Omron #Operations #HumanFactors #Automation
44,Integrating vision systems into Sysmac state machines,Vision is a sensor with opinions.,"Handshake timing, reject paths, and model drift monitoring hooks.",#MachineVision #Omron #StateMachines #Quality #IIoT
45,Recipe management for mixed cargo handling modes,Recipes encode tribal knowledge responsibly.,"Parameter validation, versioning, and rollback after bad edits.",#Batch #Recipes #PLC #Operations #SoftwareDesign
46,Ethernet/IP device adds without midnight surprises,EDS files are not folklore; they are part of the supply chain.,"Staging, VLAN confirmation, and rollback plans.",#EthernetIP #Commissioning #Network #Omron #Automation
47,"Event logging that helps root cause, not just compliance",Logs should answer 'why' without a war room.,"Structured event IDs, correlated analog snapshots, and export to analytics.",#Diagnostics #PLC #Analytics #Maintenance #Ports
48,Firmware updates across a fleet of Omron controllers,Fleet thinking beats hero debugging.,"Canary cells, staged rollouts, and compatibility matrices with I/O slices.",#FleetManagement #Omron #ChangeManagement #IIoT #Reliability
49,Studio 5000: AOI boundaries that survive the next intern project,AOIs are culture encoded in logic.,"Interfaces, versioning, and guardrails for add-on instructions in port cranes.",#Studio5000 #Rockwell #PLC #SoftwareDesign #Ports
50,GuardLogix: integrated safety where motion never sleeps,"Safety stops are part of the motion story, not an appendix.","Safety task timing, axis checks, and diagnostic narratives for maintenance.",#GuardLogix #SafetyPLC #Motion #Rockwell #Automation
51,"Stratix switches in salty air: grim reality, smart spares",Corrosion is a routing protocol.,"Spare strategy, configuration backups, and RMA discipline.",#IndustrialNetworking #Stratix #Maintenance #Ports #OT
52,"FactoryTalk alarms into Azure: meaning, not noise export",Cloud data without semantics is an expensive CSV.,"Alarm rationalization before historian shipping, asset models, and KPIs.",#Azure #IIoT #Alarms #Analytics #Rockwell
53,Logo! for auxiliary systems: when 'small' is the right risk,Not every problem needs an S7-1500 ego.,"I/O budgeting, expansion modules, and remote visibility patterns.",#Logo #Siemens #SmallPLC #Automation #Ports
54,Timers and hysteresis that survive operator creativity,"Edge cases arrive on ships, not in simulations.","Anti-tie-down, debounce, and manual modes that are boringly safe.",#PLC #ControlLogic #Safety #Commissioning #BestPractices
55,Bridging Logo! to SCADA without flattening your network,Small controllers still deserve segmentation.,"Modbus gateways, VLANs, and read-only service accounts.",#OTSecurity #Modbus #SCADA #Networking #Automation
56,Documentation that travels with the cabinet,"The next engineer is you, six months later, at 02:00.","QR-linked wiring diagrams, test records, and change history.",#Documentation #Maintenance #Commissioning #Engineering #Ports
57,CX-Programmer: modular ladder for marine auxiliaries,Clarity beats compactness when seawater is involved.,"Jump labels, subroutine boundaries, and online edit discipline.",#CXProgrammer #Omron #PLC #Marine #Automation
58,Serial heritage on CJ: when COM ports still move money,Sometimes RS-232 is not legacy; it is a contract.,"Baud-rate archaeology, isolators, and ground loops near VFDs.",#Serial #Omron #Fieldbus #Maintenance #Ports
59,Analog I/O scaling for winch drives and brake tests,Scaling mistakes echo as mechanical surprises.,"Calibration rigs, loop checks, and sign conventions.",#AnalogIO #Commissioning #PLC #Drives #Engineering
60,Migrating CP series logic with minimal production drama,Migration is a rehearsal business.,"I/O mapping tables, parallel runs, and rollback pins.",#Migration #Omron #PLC #ProjectManagement #Automation
61,Docklight scripts as executable specifications,"If the script cannot replay it, the vendor promise is still poetry.","Request/response capture, timing assertions, and regression after firmware bumps.",#Docklight #Serial #Testing #Commissioning #Automation
62,RS-485 biasing and termination: the boring hero,Most 'mystery faults' are physics homework.,"Topology maps, resistor packs, and oscilloscope spot checks.",#RS485 #Fieldbus #Troubleshooting #Electrical #Ports
63,RS-422 multidrop discipline in retrofit panels,Retrofit means negotiating old sins.,"Ground references, common-mode limits, and cable routing with VFD noise.",#RS422 #Electrical #Retrofit #Noise #Marine
64,RS-232 isolators when laptops meet cranes,USB adapters are not a grounding strategy.,"Galvanic isolation, ESD, and laptop grounding rituals.",#RS232 #Isolation #Safety #Commissioning #OT
65,Modbus RTU exception codes as API semantics,Treat exceptions as part of your interface contract.,Mapping codes to operator messages and SCADA severity.,#Modbus #Integration #SCADA #PLC #SoftwareDesign
66,Baud-rate changes without losing the plant,Parameter walks belong in maintenance windows.,"Staged device updates, monitoring windows, and rollback scripts.",#Serial #ChangeManagement #Commissioning #Risk #Automation
67,Packet capture ethics on operational buses,Visibility is power; wield it with policy.,"Read-only taps, retention limits, and access reviews.",#CyberSecurity #OT #Governance #Diagnostics #Ports
68,Scripted burn-in tests for new serial devices,Burn-in is a conversation with failure modes.,"Thermal cycling profiles, error injection, and pass/fail criteria.",#Quality #Testing #Serial #Reliability #Manufacturing
69,VFD tuning when mechanical resonance appears late,Resonance is a schedule conflict between mechanics and control bandwidth.,"Skip frequencies, filtering, and collaborative debugging with OEMs.",#VFD #Tuning #Mechanical #Automation #Ports
70,Harmonics and IEEE 519: from spreadsheet to site measurements,"Compliance is measured, not assumed.","CT placement, windowing, and active filter commissioning stories.",#PowerQuality #Harmonics #VFD #Engineering #Compliance
71,Soft starters vs VFDs: total cost of flexibility,Sometimes the best drive is the one you do not program.,"Starting profiles, mechanical wear, and network loading trade-offs.",#SoftStarter #VFD #MotorControl #TCO #Automation
72,MCC coordination: breaker curves meet PLC narratives,Protection is a team sport across disciplines.,"Selectivity studies, arc-flash labels, and alarm semantics.",#MotorControl #ElectricalSafety #PLC #MCC #Engineering
73,Braking resistors and thermal derating in hot berths,Heat sinks have feelings too.,"Duty cycles, airflow, and maintenance inspection cadence.",#VFD #Thermal #Reliability #Maintenance #Ports
74,STO wiring and proof-testing after cable damage,A crushed cable is a safety incident in slow motion.,"Continuity proofs, torque checks, and change records.",#STO #FunctionalSafety #VFD #Commissioning #Safety
75,Networked drives: firmware fleets and vulnerability handling,A drive is an OT endpoint.,"Inventory, segmentation, and vendor patch choreography.",#OTSecurity #VFD #PatchManagement #IIoT #Risk
76,Energy telemetry from drives to sustainability KPIs,kWh tells stories kW snapshots miss.,"Aggregation strategies, baseline seasons, and credible reporting.",#Energy #Sustainability #Analytics #VFD #Ports
77,Python-driven BOM checks before copper turns into rework,The cheapest correction is on the screen.,Pandas workflows comparing I/O lists to EPLAN exports.,#Python #CAD #EPLAN #Automation #Engineering
78,Dynamic terminals: generating drawings from PLC tags,Tags are the single source of truth — if you treat them that way.,"TIA symbol export, naming conventions, and validation scripts.",#DigitalEngineering #TIA #CAD #Python #Automation
79,Harness length estimation vs as-built reality,Cable trays have opinions.,Point-cloud assisted routing checks and tolerance budgeting.,#CAD #Cabling #DigitalTwin #Construction #Ports
80,"Version control for electrical datasets, not just PDFs",PDFs are prints; data is memory.,"Git LFS for exports, review gates, and release tags.",#Git #ElectricalDesign #DevOps #Documentation #Engineering
81,Rule checking for ATEX boundary symbols,A missed barrier symbol is a missed hazard conversation.,Automated checks crossing CAD and instrument lists.,#ATEX #CAD #Compliance #Python #Safety
82,Closing the loop: SCADA alarms referencing drawing sheets,Operators should not grep PDFs at 03:00.,"Hyperlinks, sheet numbers, and consistent naming between tools.",#HMI #CAD #Operations #Usability #Ports
83,Digital twin fidelity: when 'good enough' is not,Twins age like fish and firmware.,"Calibration drift, sensor replacement, and twin refresh policies.",#DigitalTwin #AI #Ports #Maintenance #IIoT
84,Forecasting berth congestion with honest uncertainty,A point forecast without intervals is a guess in a tie.,"Quantile models, weather ensembles, and operator-facing ranges.",#Forecasting #MachineLearning #Operations #Ports #Analytics
85,Anomaly detection on crane cycles: precision vs trust,Precision without explanation burns operator patience.,"SHAP-style rationales, similar past cases, and conservative thresholds.",#AnomalyDetection #ExplainableAI #Cranes #Ports #ML
86,Reinforcement learning fantasies vs. PLC reality,"Most ports need stability certificates, not exploration bonuses.",Where RL might help offline planning — and where it should not touch I/O.,#ReinforcementLearning #ControlTheory #PLC #AI #Ports
87,Simulation environments for training without risking steel,Train the brain before the hoist moves.,"Scenario libraries, scoring, and human factors metrics.",#Simulation #Training #Safety #DigitalTwin #Ports
88,Responsible AI checklists for terminal operations,Ethics is operational risk management.,"Data rights, bias reviews, and kill-switch governance.",#ResponsibleAI #Governance #Ports #Ethics #Operations
89,Azure IoT Hub ingestion with OT-appropriate batching,Cloud scale is easy; OT politeness is hard.,"Backpressure, store-and-forward gateways, and offline buffers.",#Azure #IoTHub #IIoT #Edge #Architecture
90,Stream analytics vs. lakehouse for equipment KPIs,Choose latency and cost consciously.,"Windowing strategies, late-arriving data, and reconciliation jobs.",#Azure #StreamAnalytics #DataEngineering #IIoT #Analytics
91,Identity for machines: managed identities and key rotation,Shared keys age like milk in sunlight.,"Managed identities, Azure Key Vault patterns, and break-glass.",#Azure #Security #IIoT #Identity #BestPractices
92,Python services between PLC and cloud: contract-first design,Ad-hoc JSON is debt with swagger.,"Pydantic models, versioning, and observability with OpenTelemetry.",#Python #Microservices #IIoT #Observability #Software
93,How I sequence Coursera depth with 60-hour site weeks,"Learning is scheduling, not guilt.","Micro-sprints, spaced repetition on weekends, and project tie-ins.",#ContinuousLearning #Coursera #AI #Career #Engineering
94,From lectures to ladder: applying ML metrics to PLC datasets,Accuracy is not operational readiness.,"Calibration, drift monitoring, and field validation harnesses.",#MachineLearning #MLOps #PLC #Quality #AI
95,Peer review culture inside automation teams,"The best review finds the wrong assumption, not the typo.",Lightweight checklists for logic changes and FAT evidence.,#Teamwork #Quality #Engineering #Automation #Leadership
96,Teaching juniors to respect both standard and site,Standards are maps; the site is terrain.,"Pair commissioning, story handoffs, and progressive responsibility.",#Mentoring #Commissioning #Training #Ports #Culture
97,informes.prosertek.com: from PDF chaos to searchable evidence,Search beats shuffle when the auditor lands tomorrow.,"Indexing strategies, access tiers, and traceable releases.",#Prosertek #WebPlatform #Compliance #Documentation #Ports
98,"Designing industrial web UX for gloves, salt, and impatience",Tap targets and contrast are safety features.,"Field testing, offline hints, and resilient forms.",#UX #IndustrialSoftware #Prosertek #Web #Operations
99,APIs behind internal tools: stability as a feature,Internal users are still users.,"Versioning, deprecation windows, and synthetic monitoring.",#API #SoftwareEngineering #Prosertek #Reliability #DevOps
100,Linking site events to report workflows without copy-paste,"If data crosses email, risk crosses with it.","Event hooks, deduplication, and human approval gates.",#Workflow #DataIntegration #Prosertek #Automation #Governance
